{
  "schemaVersion": 1,
  "id": "studio",
  "name": "Studio",
  "vibe": [
    "bold",
    "professional",
    "energetic"
  ],
  "mood": [
    "impressed",
    "excited"
  ],
  "category": "bold-poster",
  "lightDark": "dark",
  "typography": {
    "display": "Barlow",
    "body": "Barlow",
    "source": "google-fonts"
  },
  "colors": {
    "bg": "#1c1c1c",
    "bg-alt": "#242422",
    "yellow": "#f5d200",
    "yellow-soft": "#f0cc00"
  },
  "capabilities": {
    "pdfExport": true,
    "imageUpload": true
  },
  "source": {
    "origin": "zarazhangrui/beautiful-html-templates",
    "license": "MIT",
    "originalUrl": "https://github.com/zarazhangrui/beautiful-html-templates/blob/main/templates/studio/template.html",
    "originalPath": "templates/studio/template.html"
  },
  "ported": {
    "by": "frontend-slides-editable",
    "date": "2026-05-15",
    "notes": "Ported 3 of N slides (cover, statement-flip, contact)."
  }
}
