{
  "schemaVersion": 1,
  "id": "cobalt-grid",
  "name": "Cobalt Grid",
  "vibe": [
    "editorial",
    "futuristic",
    "academic",
    "minimal"
  ],
  "mood": [
    "calm",
    "impressed"
  ],
  "category": "editorial",
  "lightDark": "light",
  "typography": {
    "display": "Newsreader",
    "body": "Hanken Grotesk",
    "source": "google-fonts"
  },
  "colors": {
    "paper": "#F0EBDE",
    "paper-2": "#E6E0CE",
    "ink": "#1F2BE0",
    "ink-soft": "#5560E5",
    "rule": "#1F2BE0",
    "coal": "#1a1a16"
  },
  "capabilities": {
    "pdfExport": true,
    "imageUpload": true
  },
  "source": {
    "origin": "zarazhangrui/beautiful-html-templates",
    "license": "MIT",
    "originalUrl": "https://github.com/zarazhangrui/beautiful-html-templates/blob/main/templates/cobalt-grid/template.html",
    "originalPath": "templates/cobalt-grid/template.html"
  },
  "ported": {
    "by": "frontend-slides-editable",
    "date": "2026-05-15",
    "notes": "Ported 3 slides (cover, method, end)."
  }
}
