{
  "schemaVersion": 1,
  "id": "stencil-tablet",
  "name": "Stencil & Tablet",
  "vibe": [
    "editorial",
    "minimal",
    "warm",
    "academic"
  ],
  "mood": [
    "impressed",
    "calm"
  ],
  "category": "minimal",
  "lightDark": "light",
  "typography": {
    "display": "Stardos Stencil",
    "body": "Inter",
    "source": "google-fonts"
  },
  "colors": {
    "bone": "#E2DCC9",
    "paper": "#F4EFE0",
    "ink": "#0A0A0A",
    "sienna": "#A06A3C",
    "magenta": "#C73B7A",
    "orange": "#EE7A2E",
    "teal": "#2D7E73"
  },
  "capabilities": {
    "pdfExport": true,
    "imageUpload": true
  },
  "source": {
    "origin": "zarazhangrui/beautiful-html-templates",
    "license": "MIT",
    "originalUrl": "https://github.com/zarazhangrui/beautiful-html-templates/blob/main/templates/stencil-tablet/template.html",
    "originalPath": "templates/stencil-tablet/template.html"
  },
  "ported": {
    "by": "frontend-slides-editable",
    "date": "2026-05-15",
    "notes": "Ported 3 slides (dig-site cover, four layers, sign-off)."
  }
}
