{
  "schemaVersion": 1,
  "id": "capsule",
  "name": "Capsule",
  "vibe": [
    "modular",
    "playful",
    "warm",
    "elegant"
  ],
  "mood": [
    "inspired",
    "calm"
  ],
  "category": "modular",
  "lightDark": "light",
  "typography": {
    "display": "Bodoni Moda",
    "body": "Space Grotesk",
    "source": "google-fonts"
  },
  "colors": {
    "bg": "#F5F5F0",
    "fg": "#1A1A1A",
    "coral": "#E85D4E",
    "lime": "#C4D94E",
    "lavender": "#C5B5E0",
    "sky": "#8BB4F7",
    "violet": "#A06CE8",
    "yellow": "#F2D160"
  },
  "capabilities": {
    "pdfExport": true,
    "imageUpload": true
  },
  "source": {
    "origin": "zarazhangrui/beautiful-html-templates",
    "license": "MIT",
    "originalUrl": "https://github.com/zarazhangrui/beautiful-html-templates/blob/main/templates/capsule/template.html",
    "originalPath": "templates/capsule/template.html"
  },
  "ported": {
    "by": "frontend-slides-editable",
    "date": "2026-05-15",
    "notes": "Ported 3 slides (cover, four-pill grid, snap-done)."
  }
}
