{
  "schemaVersion": 1,
  "id": "cartesian",
  "name": "Cartesian",
  "vibe": [
    "editorial",
    "elegant",
    "calm",
    "warm",
    "academic"
  ],
  "mood": [
    "calm",
    "inspired"
  ],
  "category": "editorial",
  "lightDark": "light",
  "typography": {
    "display": "Playfair Display",
    "body": "Inter",
    "source": "google-fonts"
  },
  "colors": {
    "bg": "#ede8e0",
    "bg-2": "#e2dbd1",
    "text": "#1a1a1a",
    "text-2": "#5a5a5a",
    "accent": "#8a8178",
    "line": "#b8b0a4"
  },
  "capabilities": {
    "pdfExport": true,
    "imageUpload": true
  },
  "source": {
    "origin": "zarazhangrui/beautiful-html-templates",
    "license": "MIT",
    "originalUrl": "https://github.com/zarazhangrui/beautiful-html-templates/blob/main/templates/cartesian/template.html",
    "originalPath": "templates/cartesian/template.html"
  },
  "ported": {
    "by": "frontend-slides-editable",
    "date": "2026-05-15",
    "notes": "Ported 3 slides (volume opening, chapter ii, coda)."
  }
}
