{
  "schemaVersion": 1,
  "id": "playful",
  "name": "Playful",
  "vibe": [
    "playful",
    "warm",
    "energetic",
    "indie"
  ],
  "mood": [
    "inspired",
    "excited"
  ],
  "category": "playful",
  "lightDark": "light",
  "typography": {
    "display": "Syne",
    "body": "Space Grotesk",
    "source": "google-fonts"
  },
  "colors": {
    "bg": "#F0C8A0",
    "bg-alt": "#E8B88E",
    "light": "#F7DEC6",
    "text": "#1A1A1A",
    "accent": "#1A1A1A",
    "coral": "#F86F5F"
  },
  "capabilities": {
    "pdfExport": true,
    "imageUpload": true
  },
  "source": {
    "origin": "zarazhangrui/beautiful-html-templates",
    "license": "MIT",
    "originalUrl": "https://github.com/zarazhangrui/beautiful-html-templates/blob/main/templates/playful/template.html",
    "originalPath": "templates/playful/template.html"
  },
  "ported": {
    "by": "frontend-slides-editable",
    "date": "2026-05-15",
    "notes": "Ported 3 slides (peach cover, light-flip features, hi-live)."
  }
}
