{
  "schemaVersion": 1,
  "id": "biennale-yellow",
  "name": "Biennale Yellow",
  "vibe": [
    "bold",
    "editorial",
    "elegant",
    "warm"
  ],
  "mood": [
    "inspired",
    "impressed"
  ],
  "category": "bold-poster",
  "lightDark": "light",
  "typography": {
    "display": "Instrument Serif",
    "body": "Archivo",
    "source": "google-fonts"
  },
  "colors": {
    "paper": "#E9E5DB",
    "paper-deep": "#DCD6C4",
    "sun": "#F1EE2E",
    "sun-soft": "#F8F39B",
    "ink": "#1B2566",
    "ember": "#E26B4A"
  },
  "capabilities": {
    "pdfExport": true,
    "imageUpload": true
  },
  "source": {
    "origin": "zarazhangrui/beautiful-html-templates",
    "license": "MIT",
    "originalUrl": "https://github.com/zarazhangrui/beautiful-html-templates/blob/main/templates/biennale-yellow/template.html",
    "originalPath": "templates/biennale-yellow/template.html"
  },
  "ported": {
    "by": "frontend-slides-editable",
    "date": "2026-05-15",
    "notes": "Ported 3 of N slides (sun-cover, manifesto, programme)."
  }
}
