{
  "schemaVersion": 1,
  "id": "paper-and-ink",
  "name": "Paper & Ink",
  "vibe": [
    "editorial",
    "elegant",
    "warm"
  ],
  "mood": [
    "calm",
    "inspired"
  ],
  "category": "editorial",
  "lightDark": "light",
  "typography": {
    "display": "Cormorant Garamond",
    "body": "Source Serif 4",
    "source": "google-fonts"
  },
  "colors": {
    "bg-cream": "#faf9f7",
    "text-charcoal": "#1a1a1a",
    "accent-crimson": "#c41e3a"
  },
  "capabilities": {
    "pdfExport": true,
    "imageUpload": true
  },
  "source": {
    "origin": "original"
  },
  "ported": {
    "by": "frontend-slides-editable",
    "date": "2026-05-15",
    "notes": "Migrated from skill examples/generated/presets/. Runtime swapped to current standard."
  }
}
