{
  "schemaVersion": 1,
  "id": "editorial-forest",
  "name": "Editorial Forest",
  "vibe": [
    "editorial",
    "elegant",
    "calm",
    "warm"
  ],
  "mood": [
    "calm",
    "inspired"
  ],
  "category": "editorial",
  "lightDark": "light",
  "typography": {
    "display": "Source Serif 4",
    "body": "Source Serif 4",
    "source": "google-fonts"
  },
  "colors": {
    "green": "#2e4a2a",
    "green-deep": "#243a21",
    "green-lite": "#3a5a36",
    "pink": "#e89cb1",
    "pink-deep": "#d27e96",
    "cream": "#efe7d4",
    "cream-2": "#e6dcc4",
    "ink": "#1a1a17"
  },
  "capabilities": {
    "pdfExport": true,
    "imageUpload": true
  },
  "source": {
    "origin": "zarazhangrui/beautiful-html-templates",
    "license": "MIT",
    "originalUrl": "https://github.com/zarazhangrui/beautiful-html-templates/blob/main/templates/editorial-forest/template.html",
    "originalPath": "templates/editorial-forest/template.html"
  },
  "ported": {
    "by": "frontend-slides-editable",
    "date": "2026-05-15",
    "notes": "Ported 3 slides (cover, themes-trio, editorial quote)."
  }
}
