{
  "schemaVersion": 1,
  "id": "8-bit-orbit",
  "name": "8-Bit Orbit",
  "vibe": [
    "retro",
    "futuristic",
    "experimental",
    "energetic"
  ],
  "mood": [
    "excited",
    "inspired"
  ],
  "category": "retro-pixel",
  "lightDark": "dark",
  "typography": {
    "display": "Tektur",
    "body": "Chakra Petch",
    "source": "google-fonts"
  },
  "colors": {
    "pink": "#F0A6CA",
    "cyan": "#5EDCF4",
    "yellow": "#F4D03F",
    "navy": "#0F1B3D",
    "void": "#0A0E27"
  },
  "capabilities": {
    "pdfExport": true,
    "imageUpload": true
  },
  "source": {
    "origin": "zarazhangrui/beautiful-html-templates",
    "license": "MIT",
    "originalUrl": "https://github.com/zarazhangrui/beautiful-html-templates/blob/main/templates/8-bit-orbit/template.html",
    "originalPath": "templates/8-bit-orbit/template.html"
  },
  "ported": {
    "by": "frontend-slides-editable",
    "date": "2026-05-15",
    "notes": "Ported 3 of 10 slides (cover, features, game-over)."
  }
}
