{
  "schemaVersion": 1,
  "id": "coral",
  "name": "Coral",
  "vibe": [
    "bold",
    "editorial",
    "elegant"
  ],
  "mood": [
    "impressed",
    "inspired"
  ],
  "category": "bold-poster",
  "lightDark": "dark",
  "typography": {
    "display": "Bebas Neue",
    "body": "Inter",
    "source": "google-fonts"
  },
  "colors": {
    "coral": "#E85D5D",
    "coral-dark": "#D44A4A",
    "cream": "#F5F0E8",
    "cream-dark": "#E8E0D4",
    "black": "#1A1A1A",
    "gray": "#6B6B6B"
  },
  "capabilities": {
    "pdfExport": true,
    "imageUpload": true
  },
  "source": {
    "origin": "zarazhangrui/beautiful-html-templates",
    "license": "MIT",
    "originalUrl": "https://github.com/zarazhangrui/beautiful-html-templates/blob/main/templates/coral/template.html",
    "originalPath": "templates/coral/template.html"
  },
  "ported": {
    "by": "frontend-slides-editable",
    "date": "2026-05-15",
    "notes": "Ported 3 of N slides (cover, statement-flip, subscribe)."
  }
}
