{
  "schemaVersion": 1,
  "id": "dark-botanical",
  "name": "Dark Botanical",
  "vibe": [
    "elegant",
    "editorial",
    "warm"
  ],
  "mood": [
    "inspired",
    "calm"
  ],
  "category": "editorial",
  "lightDark": "dark",
  "typography": {
    "display": "Cormorant",
    "body": "IBM Plex Sans",
    "source": "google-fonts"
  },
  "colors": {
    "bg-primary": "#0f0f0f",
    "text-primary": "#e8e4df",
    "accent-warm": "#d4a574",
    "accent-pink": "#e8b4b8",
    "accent-gold": "#c9b896"
  },
  "capabilities": {
    "pdfExport": true,
    "imageUpload": true
  },
  "source": {
    "origin": "original"
  },
  "ported": {
    "by": "frontend-slides-editable",
    "date": "2026-05-15",
    "notes": "Migrated from skill examples/generated/presets/. Runtime swapped to current standard."
  }
}
