{
  "schemaVersion": 1,
  "id": "bold-signal",
  "name": "Bold Signal",
  "vibe": [
    "bold",
    "professional",
    "energetic"
  ],
  "mood": [
    "impressed",
    "excited"
  ],
  "category": "dark",
  "lightDark": "dark",
  "typography": {
    "display": "Archivo Black",
    "body": "Space Grotesk",
    "source": "google-fonts"
  },
  "colors": {
    "bg-primary": "#1a1a1a",
    "card-bg": "#FF5722",
    "text-primary": "#ffffff",
    "text-on-card": "#1a1a1a"
  },
  "capabilities": {
    "pdfExport": true,
    "imageUpload": true
  },
  "source": {
    "origin": "original"
  },
  "ported": {
    "by": "frontend-slides-editable",
    "date": "2026-05-15",
    "notes": "Migrated from skill examples/generated/presets/. Runtime swapped to current standard."
  }
}
