{
  "schemaVersion": 1,
  "id": "pin-and-paper",
  "name": "Pin & Paper",
  "vibe": [
    "editorial",
    "handwritten",
    "warm",
    "indie"
  ],
  "mood": [
    "inspired",
    "calm"
  ],
  "category": "handwriting",
  "lightDark": "light",
  "typography": {
    "display": "Space Grotesk",
    "body": "Space Grotesk",
    "source": "google-fonts"
  },
  "colors": {
    "paper": "#F5ECA0",
    "paper-d": "#EBE190",
    "paper-vd": "#E0D67E",
    "ink": "#1F3A8A",
    "ink-deep": "#0F1F4A"
  },
  "capabilities": {
    "pdfExport": true,
    "imageUpload": true
  },
  "source": {
    "origin": "zarazhangrui/beautiful-html-templates",
    "license": "MIT",
    "originalUrl": "https://github.com/zarazhangrui/beautiful-html-templates/blob/main/templates/pin-and-paper/template.html",
    "originalPath": "templates/pin-and-paper/template.html"
  },
  "ported": {
    "by": "frontend-slides-editable",
    "date": "2026-05-15",
    "notes": "Ported 3 slides (cover, three principles, endpaper)."
  }
}
