{
  "schemaVersion": 1,
  "id": "editorial-tri-tone",
  "name": "Editorial Tri-Tone",
  "vibe": [
    "editorial",
    "warm",
    "energetic",
    "elegant"
  ],
  "mood": [
    "inspired",
    "impressed"
  ],
  "category": "editorial",
  "lightDark": "light",
  "typography": {
    "display": "Instrument Serif",
    "body": "Bricolage Grotesque",
    "source": "google-fonts"
  },
  "colors": {
    "pink": "#F2B6C6",
    "cream": "#F2D86A",
    "burgundy": "#7A1F35",
    "paper": "#FEFAF0",
    "ink": "#1a1a16"
  },
  "capabilities": {
    "pdfExport": true,
    "imageUpload": true
  },
  "source": {
    "origin": "zarazhangrui/beautiful-html-templates",
    "license": "MIT",
    "originalUrl": "https://github.com/zarazhangrui/beautiful-html-templates/blob/main/templates/editorial-tri-tone/template.html",
    "originalPath": "templates/editorial-tri-tone/template.html"
  },
  "ported": {
    "by": "frontend-slides-editable",
    "date": "2026-05-15",
    "notes": "Ported 3 slides (pink cover, cream method, burgundy end)."
  }
}
