{
  "schemaVersion": 1,
  "id": "bold-poster",
  "name": "Bold Poster",
  "vibe": ["bold", "editorial", "energetic", "indie"],
  "mood": ["impressed", "excited"],
  "category": "bold-poster",
  "lightDark": "light",
  "typography": {
    "display": "Shrikhand",
    "body": "Libre Baskerville",
    "mono": "Space Grotesk",
    "source": "google-fonts"
  },
  "colors": {
    "background": "#FFFFFF",
    "dark": "#1C1410",
    "red": "#D8000F",
    "light": "#F5F2EF"
  },
  "capabilities": {
    "pdfExport": true,
    "imageUpload": true
  },
  "source": {
    "origin": "zarazhangrui/beautiful-html-templates",
    "license": "MIT",
    "originalPath": "templates/bold-poster/template.html",
    "originalUrl": "https://github.com/zarazhangrui/beautiful-html-templates/blob/main/templates/bold-poster/template.html"
  },
  "ported": {
    "by": "frontend-slides-editable",
    "date": "2026-05-15",
    "notes": "Ported 4 of 10 source slides (hero, red, pillars, close). Replaced source's position:absolute slide system with scroll-snap. Wrapped movable copy as [data-slide-object] inside .slide-edit-layer."
  }
}
