{
  "schemaVersion": 1,
  "id": "simular-ai",
  "name": "Simular AI",
  "vibe": [
    "bold",
    "editorial",
    "elegant"
  ],
  "mood": [
    "inspired",
    "excited"
  ],
  "category": "editorial",
  "lightDark": "light",
  "typography": {
    "display": "Adamina",
    "body": "Instrument Sans",
    "source": "google-fonts"
  },
  "colors": {
    "paper": "#FDFDFD",
    "ink": "#000000",
    "accent": "#672ED9",
    "muted": "#B0A49B",
    "extra-1": "#423D3B",
    "extra-2": "#F2E0CC",
    "extra-3": "#8B8B8B"
  },
  "capabilities": {
    "pdfExport": true,
    "imageUpload": true
  },
  "source": {
    "origin": "url:https://www.simular.ai/",
    "originalUrl": "https://www.simular.ai/"
  },
  "ported": {
    "by": "extract_style_from_url.py",
    "date": "2026-05-15",
    "notes": "DRAFT \u2014 extracted from URL. Review _source.png and refine before publishing."
  }
}
