{
  "schemaVersion": 1,
  "id": "block-frame",
  "name": "Block Frame",
  "vibe": [
    "bold",
    "experimental",
    "brutalism",
    "energetic"
  ],
  "mood": [
    "excited",
    "impressed"
  ],
  "category": "brutalism",
  "lightDark": "light",
  "typography": {
    "display": "Inter",
    "body": "Inter",
    "source": "google-fonts"
  },
  "colors": {
    "pink": "#FE90E8",
    "blue": "#C0F7FE",
    "green": "#99E885",
    "yellow": "#F7CB46",
    "cream": "#FFDC8B",
    "black": "#000000",
    "offwhite": "#FFFDF5"
  },
  "capabilities": {
    "pdfExport": true,
    "imageUpload": true
  },
  "source": {
    "origin": "zarazhangrui/beautiful-html-templates",
    "license": "MIT",
    "originalUrl": "https://github.com/zarazhangrui/beautiful-html-templates/blob/main/templates/block-frame/template.html",
    "originalPath": "templates/block-frame/template.html"
  },
  "ported": {
    "by": "frontend-slides-editable",
    "date": "2026-05-15",
    "notes": "Ported 4 of 10 source slides (hero, three-card features, quote, closing). Source used position:absolute slide system \u2014 replaced with scroll-snap."
  }
}
